{
  "schema": "pelican.ui_semantic_fixture",
  "version": 1,
  "viewport": {
    "framebuffer_px": [1920, 1080],
    "ui_scale": 1.5,
    "content_rect_px": [0, 0, 1280, 720]
  },
  "document": {
    "key": "hud",
    "revision": "sha256:e3b0c44298fc1c149afbf4c8996fb92427ae41e4649b934ca495991b7852b855"
  },
  "widgets": [
    {
      "id": "root",
      "type": "panel",
      "rect_ui": [0, 0, 1280, 720],
      "clip_ui": [0, 0, 1280, 720],
      "layer": 0,
      "decl_seq": 0,
      "overflow": "visible"
    },
    {
      "id": "root/play",
      "type": "button",
      "rect_ui": [40, 24, 160, 56],
      "clip_ui": [0, 0, 1280, 720],
      "layer": 0,
      "decl_seq": 3
    }
  ],
  "draw_runs": [
    {
      "pipeline": "rgba_straight",
      "sampler": "nearest",
      "texture": "atlas:ui/page:0",
      "scissor_px": [0, 0, 1920, 1080],
      "first_index": 0,
      "index_count": 6
    },
    {
      "pipeline": "rgba_straight",
      "sampler": "linear",
      "texture": "white",
      "scissor_px": [60, 36, 240, 84],
      "first_index": 6,
      "index_count": 6
    }
  ],
  "input_trace": [
    {
      "event_seq": 10,
      "kind": "pointer_move",
      "pointer_id": 0,
      "position_ui": [50, 30],
      "target": "root/play",
      "consumed": ["mouse:move"],
      "effects": ["hover_enter"]
    },
    {
      "event_seq": 11,
      "kind": "pointer_down",
      "pointer_id": 0,
      "button": "left",
      "position_ui": [50, 30],
      "target": "root/play",
      "consumed": ["mouse:left"],
      "effects": ["capture"]
    },
    {
      "event_seq": 12,
      "kind": "pointer_move",
      "pointer_id": 0,
      "position_ui": [70, 32],
      "target": "root/play",
      "consumed": ["mouse:move"],
      "effects": ["drag_start", "drag"]
    },
    {
      "event_seq": 13,
      "kind": "pointer_up",
      "pointer_id": 0,
      "button": "left",
      "position_ui": [70, 32],
      "target": "root/play",
      "consumed": ["mouse:left"],
      "effects": ["release_capture", "click"]
    },
    {
      "event_seq": 14,
      "kind": "pointer_down",
      "pointer_id": 1,
      "button": "right",
      "position_ui": [400, 300],
      "target": "root",
      "consumed": ["mouse:right", "key:space", "touch:0", "pad:dpad_up"],
      "effects": ["capture"]
    },
    {
      "event_seq": 15,
      "kind": "pointer_cancel",
      "pointer_id": 1,
      "effects": ["cancel", "release_capture"]
    },
    {
      "event_seq": 16,
      "kind": "pointer_move",
      "pointer_id": 0,
      "position_ui": [-20, 900],
      "effects": ["hover_exit"]
    },
    {
      "event_seq": 17,
      "kind": "pointer_down",
      "pointer_id": 0,
      "button": "middle",
      "position_ui": [50, 30],
      "target": "root/play",
      "consumed": ["mouse:middle"],
      "effects": ["capture"]
    },
    {
      "event_seq": 18,
      "kind": "pointer_up",
      "pointer_id": 0,
      "button": "middle",
      "position_ui": [50, 30],
      "target": "root/play",
      "consumed": ["mouse:middle"],
      "effects": ["release_capture", "click"]
    }
  ],
  "lifecycle": []
}
